{
  "ir_version": "1.0",
  "semantic_hash": null,
  "objective": {
    "statement": "Convert the callback-based file watcher in tools/watcher.js to async iteration, targeting Node 22 only with no compatibility shims, while keeping the CLI flags and exit codes identical.",
    "kind": "refactor",
    "success_definition": "tools/watcher.js consumes file-system watch events via async iteration instead of callbacks, runs on Node 22 without any compatibility shims, and its CLI flags and process exit codes are identical to the pre-change behavior.",
    "source_ref": "user_input"
  },
  "goals": [
    {
      "id": "g1",
      "statement": "Convert the callback-based file watcher in tools/watcher.js to async iteration.",
      "priority": "must",
      "acceptance": [
        "File-system watch events in tools/watcher.js are consumed via async iteration rather than a callback-based API.",
        "The implementation relies on Node 22 directly and introduces no compatibility shims."
      ],
      "source_ref": "user_input"
    },
    {
      "id": "g2",
      "statement": "Keep the CLI flags and exit codes of tools/watcher.js identical to their current behavior.",
      "priority": "must",
      "acceptance": [
        "Every CLI flag accepted before the change is accepted after the change with the same behavior.",
        "Process exit codes for all outcomes match the pre-change behavior."
      ],
      "source_ref": "user_input"
    }
  ],
  "constraints": [
    {
      "id": "c1",
      "kind": "compatibility",
      "hardness": "hard",
      "statement": "Target Node 22 only; do not add compatibility shims for other Node versions.",
      "source_ref": "user_input"
    }
  ],
  "non_goals": [
    {
      "id": "n1",
      "statement": "Supporting Node versions other than 22, including via compatibility shims.",
      "source_ref": "user_input"
    }
  ],
  "scope": {
    "include": [
      "tools/watcher.js"
    ],
    "exclude": [],
    "blast_radius": "file",
    "source_ref": "user_input"
  },
  "required_capabilities": [
    "fs_read",
    "fs_write",
    "shell"
  ],
  "context_refs": [],
  "assumptions": [
    {
      "id": "a1",
      "statement": "The conversion will use Node 22's built-in async-iterator watch API (fs.promises.watch) rather than introducing a new dependency.",
      "confidence": "medium",
      "source_ref": "user_input"
    },
    {
      "id": "a2",
      "statement": "The current CLI flags and exit codes of tools/watcher.js are correct as-is and define the exact behavior to preserve.",
      "confidence": "high",
      "source_ref": "user_input"
    }
  ],
  "open_questions": [
    {
      "id": "q1",
      "question": "Which async-iteration source should replace the callback-based watcher?",
      "options": [
        "Node 22's built-in fs.promises.watch async iterator",
        "A custom async iterator wrapping the existing watch mechanism",
        "A third-party file-watching library exposing async iteration"
      ],
      "default_assumption_ref": "a1",
      "blocking": false,
      "source_ref": "user_input"
    }
  ],
  "verification": [
    {
      "id": "v1",
      "kind": "review",
      "spec": "Review the modified tools/watcher.js and confirm watch events are consumed via async iteration (e.g., for await) with no callback-based watcher API remaining.",
      "expected": "No callback-based watch API remains; events are consumed via async iteration.",
      "satisfies": [
        "g1"
      ],
      "source_ref": "user_input"
    },
    {
      "id": "v2",
      "kind": "review",
      "spec": "Review the modified tools/watcher.js and confirm it contains no compatibility shims for Node versions other than 22.",
      "expected": "No compatibility shims present; the code relies on Node 22 directly.",
      "satisfies": [
        "g1"
      ],
      "source_ref": "user_input"
    },
    {
      "id": "v3",
      "kind": "manual",
      "spec": "Run the watcher CLI with each previously supported flag and compare behavior against the pre-change version.",
      "expected": "All CLI flags behave identically to the pre-change version.",
      "satisfies": [
        "g2"
      ],
      "source_ref": "user_input"
    },
    {
      "id": "v4",
      "kind": "manual",
      "spec": "Exercise the watcher's success and error exit paths and compare process exit codes against the pre-change version.",
      "expected": "Exit codes are identical to the pre-change version for every exercised path.",
      "satisfies": [
        "g2"
      ],
      "source_ref": "user_input"
    }
  ],
  "deliverables": [
    {
      "id": "d1",
      "kind": "code_change",
      "description": "Modified tools/watcher.js with the file watcher converted from callbacks to async iteration, preserving CLI flags and exit codes.",
      "source_ref": "user_input"
    }
  ],
  "risk": {
    "level": "medium",
    "factors": [
      "Rewriting event handling to async iteration can subtly alter error and cleanup paths, risking changes to exit codes that must remain identical.",
      "No automated tests or verification commands for the CLI flags and exit codes were specified in the task.",
      "Differences between the callback-based watch API and the async-iterator API (e.g., error delivery, shutdown timing) may require careful handling to preserve behavior."
    ]
  }
}
